{
  "loop_id": "semantic-source-discovery",
  "iteration": 1,
  "max_iterations": 6,
  "status": "complete",
  "repo_fingerprint": "aaa948fffcdc369e6f10956cb4c336e8cd876c78",
  "scope": "read-only semantic source discovery limited to taskdesk-legacy plus db after user permission",
  "cache_dir": ".cache/scripts",
  "work_dir": ".work/semantic-loop",
  "last_completed_phase": "report",
  "weakest_score": null,
  "next_action": null,
  "history": [
    {
      "iteration": 1,
      "summary": "Started scoped semantic discovery for taskdesk-legacy plus db (ten-dimension contract with doc alignment and runtime journeys).",
      "timestamp": "2026-07-07T20:39:05.084690+00:00"
    },
    {
      "iteration": 1,
      "summary": "Verification passed=True; weakest=None.",
      "timestamp": "2026-07-07T20:39:07.532253+00:00"
    }
  ]
}
